{
  "schema_version": "1.0.0",
  "review_id": "CR-CARESHIFT-V0.4",
  "pilot_id": "careshift-manager",
  "repository": "LuisHdezE/CareShift_Manager",
  "mode": "brownfield",
  "baseline_blueprint": "0.3.0",
  "target_blueprint": "0.4.0-dev",
  "reviewed_at": "2026-08-25T16:01:49-03:00",
  "reviewed_sources": [
    {"repository":"LuisHdezE/SoftwareDevelopmentBlueprint","kind":"blueprint","ref":"main","sha":"fb5ea5f82c80bc4b7afe600834ca3f681254b70b","note":"Blueprint main after merged V4-4 PR #8."},
    {"repository":"LuisHdezE/CareShift_Manager","kind":"consumer_main","ref":"main","sha":"afeb2f7928f884285d473f9989fb5acae650e9cc","note":"CareShift main after merged visual identity/design system PR #16."},
    {"repository":"LuisHdezE/CareShift_Manager","kind":"tracked_branch","ref":"blueprint/mockups-batch-01","sha":"81822e07397397e3beab7eb8d317b5d2c0243ab7","note":"Pending mockup pilot branch, 13 ahead / 0 behind at review."}
  ],
  "policy": {"automatic_migration":false,"align_do_not_rewrite":true,"grandfather_existing_evidence":true,"consumer_mutated_by_review":false},
  "recommendation": "ADOPT_INCREMENTALLY",
  "summary": {"KEEP":8,"ADOPT":9,"MIGRATE":1,"DEFER":4,"N/A":2},
  "findings": [
    {"id":"CRF-001","area":"Brownfield governance","v0_4_change":"Preserve ALIGN, DO NOT REWRITE and observed/inferred/proposed separation","classification":"KEEP","rationale":"CareShift already applies the Brownfield rule and explicitly labels observed, inferred and proposed UI knowledge.","evidence":[".blueprint/INTERFACE_INVENTORY.md","Blueprint BLUEPRINT.md"],"action":"Keep the existing Brownfield evidence and semantics unchanged.","requires_consumer_change":false,"destructive_rewrite_allowed":false},
    {"id":"CRF-002","area":"API pipeline","v0_4_change":"Runtime-backed API gates and contract evidence","classification":"KEEP","rationale":"CareShift is the proving pilot for API implementation, OpenAPI parity, Postman, live HTTP/MySQL QA, security and audit evidence.","evidence":[".blueprint/status.yaml",".blueprint/evidence/API_QA.md",".blueprint/evidence/OPENAPI_VALIDATION.md"],"action":"Grandfather the existing PASS evidence; do not rerun or rewrite it solely for v0.4 adoption.","requires_consumer_change":false,"destructive_rewrite_allowed":false},
    {"id":"CRF-003","area":"Interface inventory","v0_4_change":"Stable numbered web inventory with API responsibilities and web-only exceptions","classification":"KEEP","rationale":"The 30-view inventory already uses WEB-### IDs, documents roles/data/actions/states/navigation, preserves web-only behavior and records Brownfield gaps.","evidence":[".blueprint/INTERFACE_INVENTORY.md"],"action":"Keep the semantic inventory as canonical pilot evidence.","requires_consumer_change":false,"destructive_rewrite_allowed":false},
    {"id":"CRF-004","area":"Interface inventory artifact model","v0_4_change":"Machine-readable v0.4 inventory representation or compatibility adapter","classification":"ADOPT","rationale":"v0.4 adds a schema-backed artifact model for AI continuity. CareShift's Markdown inventory is semantically strong but not itself the new JSON schema artifact.","evidence":[".blueprint/INTERFACE_INVENTORY.md","schemas/interface-inventory.schema.json"],"action":"When CareShift adopts v0.4, add a non-destructive machine-readable companion or adapter derived from the existing inventory; do not replace the source evidence unnecessarily.","requires_consumer_change":true,"destructive_rewrite_allowed":false},
    {"id":"CRF-005","area":"Visual identity and Design System","v0_4_change":"Explicit identity, tokens, responsive, RBAC presentation, semantic states and accessibility","classification":"KEEP","rationale":"CareShift already documents these requirements, including 44 px touch targets, Problem Details states, non-color semantics and reduced motion.","evidence":[".blueprint/VISUAL_IDENTITY.md",".blueprint/DESIGN_SYSTEM.md",".blueprint/DESIGN_TOKENS.json"],"action":"Keep these artifacts and treat them as approved design inputs.","requires_consumer_change":false,"destructive_rewrite_allowed":false},
    {"id":"CRF-006","area":"Project manifest","v0_4_change":"Artifact location registry","classification":"ADOPT","rationale":"v0.4 allows the consumer to declare its real artifact paths instead of forcing physical path migration.","evidence":[".blueprint/project.yaml","schemas/project.schema.json"],"action":"Add artifact_locations during v0.4 adoption pointing to CareShift's existing paths and mockup root.","requires_consumer_change":true,"destructive_rewrite_allowed":false},
    {"id":"CRF-007","area":"Post-API phases","v0_4_change":"Split mockup planning, mockups, visual review and client architecture","classification":"ADOPT","rationale":"CareShift v0.3 status currently compresses these responsibilities. v0.4 makes the gates independently auditable.","evidence":[".blueprint/status.yaml","catalog/phases.yaml","catalog/gates.yaml"],"action":"Add the v0.4 post-API phase names/checks when the consumer version is upgraded; preserve completed earlier evidence.","requires_consumer_change":true,"destructive_rewrite_allowed":false},
    {"id":"CRF-008","area":"Scoped delivery","v0_4_change":"Interface slices and scoped gates","classification":"ADOPT","rationale":"v0.4 permits a coherent slice to progress without granting approval to unrelated interfaces or platforms.","evidence":[".blueprint/status.yaml","schemas/status.schema.json"],"action":"Represent Operational Core as an interface slice and use scoped visual_review_pass/client_architecture_ready entries when adoption occurs.","requires_consumer_change":true,"destructive_rewrite_allowed":false},
    {"id":"CRF-009","area":"Mockup planning","v0_4_change":"Maximum 10 views, inventory traceability, API IDs and repository-owned assets","classification":"KEEP","rationale":"The pending batch already contains exactly ten planned views, stable inventory/API IDs and versioned asset paths.","evidence":[".blueprint/mockups/BATCH_01.json",".blueprint/mockups/BATCH_01.md"],"action":"Keep the batch composition, specifications, prompts and asset files.","requires_consumer_change":false,"destructive_rewrite_allowed":false},
    {"id":"CRF-010","area":"Mockup manifest","v0_4_change":"v0.4 mockup batch schema and per-view review fields","classification":"MIGRATE","rationale":"The v0.3 pilot manifest lacks interface_slice, per-view platform, review_status, contract_review_status, accessibility_review_status, reference_inputs and evidence IDs required by v0.4.","evidence":[".blueprint/mockups/BATCH_01.json","schemas/mockup-batch.schema.json"],"action":"When resuming the pilot, migrate or add a v0.4-compatible manifest while preserving the ten view IDs, API mappings, four existing assets and six pending states.","requires_consumer_change":true,"destructive_rewrite_allowed":false},
    {"id":"CRF-011","area":"Visual approval semantics","v0_4_change":"GENERATED != REVIEWED != APPROVED","classification":"ADOPT","rationale":"The four SVGs are generated references only. File existence cannot satisfy manual, contract or accessibility approval.","evidence":[".blueprint/mockups/BATCH_01.json","schemas/mockup-batch.schema.json"],"action":"Keep all four current visuals at GENERATED until explicit review records PASS/APPROVED.","requires_consumer_change":true,"destructive_rewrite_allowed":false},
    {"id":"CRF-012","area":"Visual Review Gate","v0_4_change":"Per-slice visual review before implementation","classification":"ADOPT","rationale":"The current branch has generated assets but no v0.4 scoped visual gate evidence.","evidence":[".blueprint/mockups/BATCH_01.json","catalog/gates.yaml"],"action":"Perform contract, accessibility and manual review for the target slice before any React implementation is unblocked.","requires_consumer_change":true,"destructive_rewrite_allowed":false},
    {"id":"CRF-013","area":"Existing visual assets","v0_4_change":"Four generated SVG references","classification":"KEEP","rationale":"The assets are already repository-owned and mapped to WEB-001, WEB-004, WEB-005 and WEB-006.","evidence":[".blueprint/mockups/batch-01/assets/WEB-001-login.svg",".blueprint/mockups/batch-01/assets/WEB-004-dashboard.svg",".blueprint/mockups/batch-01/assets/WEB-005-alertas.svg",".blueprint/mockups/batch-01/assets/WEB-006-asistencia.svg"],"action":"Preserve and review them; do not regenerate merely to fit v0.4.","requires_consumer_change":false,"destructive_rewrite_allowed":false},
    {"id":"CRF-014","area":"Pending visual generation","v0_4_change":"Six remaining Operational Core mockups","classification":"DEFER","rationale":"Completing the images is product work, not required to validate the master Blueprint v0.4 contract.","evidence":[".blueprint/mockups/BATCH_01.json","documentation/BLUEPRINT_V0_4_PILOT_AUDIT.md"],"action":"Resume generation only when CareShift returns to mockup execution.","requires_consumer_change":false,"destructive_rewrite_allowed":false},
    {"id":"CRF-015","area":"Client architecture","v0_4_change":"Canonical web client architecture contract","classification":"DEFER","rationale":"No slice has visual_review_pass yet, so client architecture must not be declared PASS.","evidence":["schemas/client-architecture.schema.json",".blueprint/mockups/BATCH_01.json"],"action":"After an interface slice is visually approved, create a CareShift web client architecture artifact bound to that slice and API IDs.","requires_consumer_change":true,"destructive_rewrite_allowed":false},